<?xml version="1.0"?>
<!DOCTYPE Report
[
<!ELEMENT Report (General ,(Doc|BPT)) >
<!ATTLIST Report ver CDATA #REQUIRED tmZone CDATA #REQUIRED>

<!ELEMENT General ( DocLocation ) >
<!ATTLIST General productName CDATA #REQUIRED productVer CDATA #REQUIRED os CDATA #REQUIRED host CDATA #REQUIRED qcserver CDATA #IMPLIED qcproject CDATA #IMPLIED SolManSolutionId CDATA #IMPLIED SolManProjectId CDATA #IMPLIED SolManTestPlanId CDATA #IMPLIED SolManTestPackageId CDATA #IMPLIED SolManUserInfoData CDATA #IMPLIED  >

<!ELEMENT BPT (DName,Res,DVer?,TSet?,TInst?,NodeArgs,AdditionalInfo*,Doc*) >
<!ATTLIST BPT rID ID #REQUIRED >

<!ELEMENT Doc (DName,ConfName?,Res,DVer?,TSet?,TInst?,RunType?,DT?,AdditionalInfo*,Step*,DIter*,Step*,Action*,Doc*,Summary?,TestMaintenanceSummary*,NodeArgs?) >
<!ATTLIST Doc rID ID #REQUIRED type (Test|BC|BPTWrapperTest|Flow|Group|Action) "Test" productName CDATA #REQUIRED BCIter CDATA #IMPLIED >

<!ELEMENT RunType ( #PCDATA )>
<!ATTLIST RunType fmStep (False|True) "False" batch (False|True) "False" upDesc (False|True) "False" upChk (False|True) "False" upAS (False|True) "False">

<!ELEMENT DName ( #PCDATA ) >

<!ELEMENT ConfName ( #PCDATA ) >

<!ELEMENT Res ( #PCDATA ) >

<!ELEMENT AdditionalInfo (AdditionalDataName,AdditionalDataValue ) >

<!ELEMENT AdditionalDataName ( #PCDATA ) >

<!ELEMENT AdditionalDataValue ( #PCDATA ) >

<!ELEMENT DVer ( #PCDATA ) >

<!ELEMENT TSet ( #PCDATA ) >

<!ELEMENT TInst ( #PCDATA ) >

<!ELEMENT DIter (Step*,Action+,Summary?,NodeArgs)>
<!ATTLIST DIter rID ID #REQUIRED iterID CDATA #REQUIRED>

<!ELEMENT DocLocation ( #PCDATA )>

<!ELEMENT Action (AName,AIter*,(Step|HtmlStep|Action)*, Summary,ActionMaintenanceSummary*, NodeArgs ) >
<!ATTLIST Action rID ID #REQUIRED>

<!ELEMENT AIter ((Step|HtmlStep|Action)*,DataMapping?, Summary?,NodeArgs) >
<!ATTLIST AIter rID ID #REQUIRED iterID CDATA #REQUIRED isCountable (False|True) "False" >

<!ELEMENT AName ( #PCDATA ) >

<!ELEMENT TestMaintenanceSummary (ActionMaintenanceSummary*) >
<!ATTLIST TestMaintenanceSummary ObjectsAdded CDATA #REQUIRED ObjectsUpdated CDATA #REQUIRED StepsUpdated CDATA #REQUIRED StepsComments CDATA #REQUIRED><!ELEMENT ActionMaintenanceSummary (ObjectChange* ) >
<!ATTLIST ActionMaintenanceSummary Action CDATA #REQUIRED Objects CDATA #REQUIRED Updated CDATA #REQUIRED LinesTotal CDATA #REQUIRED Added CDATA #REQUIRED LinesUpdated CDATA #REQUIRED>

<!ELEMENT ObjectChange  (Hierarchy, PropertyChangeList* ) >
<!ATTLIST ObjectChange Operation CDATA #IMPLIED OriginalRepository CDATA #IMPLIED>

<!ELEMENT PropertyChangeList (PropertyDef*) >

<!ELEMENT PropertyDef (OriginalValue, NewValue) >
<!ATTLIST PropertyDef PropName CDATA #REQUIRED OriginRegularExpression (True|False) "False" NewRegularExpression (True|False) "False" AddedProperty (True|False) "False" >

<!ELEMENT OriginalValue ( #PCDATA )>

<!ELEMENT NewValue ( #PCDATA )>

<!ELEMENT Hierarchy  (ObjectName, Hierarchy*) >
<!ATTLIST Hierarchy MicClass CDATA #REQUIRED>

<!ELEMENT ObjectName  ( #PCDATA ) >

<!ELEMENT Step (Obj,Details,Time,TimeTick* ,(Step|HtmlStep|Doc)*, DataMapping?, NodeArgs) >
<!ATTLIST Step rID ID #REQUIRED retval CDATA #IMPLIED>

<!ELEMENT HtmlStep (HTML,TimeTick*,(Step|HtmlStep|Doc)*,NodeArgs) >
<!ATTLIST HtmlStep rID ID #REQUIRED >

<!ELEMENT Obj ( #PCDATA ) >
<!ATTLIST Obj plainTxt (False|True) "True">

<!ELEMENT Details ( #PCDATA ) >
<!ATTLIST Details plainTxt (False|True) "True">

<!ELEMENT Time ( #PCDATA ) >

<!ELEMENT HTML ( #PCDATA ) >

<!ELEMENT Disp ( #PCDATA ) >

<!ELEMENT TimeTick ( #PCDATA ) >

<!ELEMENT DataMapping ( DataMappedItem* )>
<!ELEMENT DataMappedItem EMPTY >
<!ATTLIST DataMappedItem dsName CDATA #REQUIRED >
<!ATTLIST DataMappedItem rowId CDATA #REQUIRED >

<!ELEMENT NodeArgs (Disp,TopPane?,BtmPane?,ExtendedInfo? )>
<!ATTLIST NodeArgs eType CDATA #REQUIRED icon CDATA #REQUIRED nRep CDATA #REQUIRED UserNote CDATA #IMPLIED filter (False|True) "True">
<!ATTLIST NodeArgs status (Passed|Failed|Done|Warning|Information) "Done">
<!ATTLIST NodeArgs iconSel CDATA #IMPLIED nType CDATA #IMPLIED MovieMarker CDATA "">
<!ATTLIST NodeArgs Source CDATA #IMPLIED SourceLine CDATA #IMPLIED StepFlowItemKey CDATA #IMPLIED >

<!ELEMENT TopPane (Path)>

<!ELEMENT BtmPane ( (Path|WR)?,ASHilite?)>
<!ATTLIST BtmPane vType CDATA "HTML">

<!ELEMENT Path ( #PCDATA ) >

<!ELEMENT ASHilite ( #PCDATA ) >

<!ELEMENT WR ( #PCDATA ) >

<!ELEMENT ExtendedInfo ( StepData ) >

<!ATTLIST ExtendedInfo StepType CDATA #REQUIRED>
<!ELEMENT DT (NodeArgs) >
<!ATTLIST DT rID ID #REQUIRED>

<!ELEMENT Summary (Param*)>
<!ATTLIST Summary sTime CDATA #IMPLIED eTime CDATA #IMPLIED passed CDATA #IMPLIED failed CDATA #IMPLIED warnings CDATA #IMPLIED retval CDATA #IMPLIED stopped (False|True) "False" >

<!ELEMENT Param (ParamName,ParamVal)+ >
<!ATTLIST Param paramInOut (In|Out) "In">

<!ELEMENT ParamName ( #PCDATA ) >

<!ELEMENT ParamVal ( #PCDATA ) >

]
>
<Report ver="2.0" tmZone="India Standard Time">
<General productName="HPE Unified Functional Testing" productVer="14.03" os="" host="LIN33001220"><DocLocation><![CDATA[C:\framework\QTP-Hybrid-Framework\QTP-Hybrid-Framework\TestCases\od]]></DocLocation></General>
<Doc rID="T1"   productName= "HPE Unified Functional Testing"  >
<DName><![CDATA[od]]></DName>
<Res><![CDATA[Res1]]></Res>
<DT rID="T2">
<NodeArgs eType="Table" icon="2" nRep="4" filter="False" >
<Disp><![CDATA[Run-Time Data Table]]></Disp>
<BtmPane vType="Table" >
<Path><![CDATA[Default.xls]]></Path>
</BtmPane>
</NodeArgs>
</DT>
<DIter rID="T3" iterID="1" >
<Action rID="T4">
<AName><![CDATA[login]]></AName>
<Step rID="T5">
<Obj plainTxt="False" ><![CDATA[OrangeHRM]]></Obj>
<Details plainTxt="False" ><![CDATA[<table><tr><td><span style="text-align : left; font-size : 12px; ">Local Browser</span></td></tr></table>]]></Details>
<Time><![CDATA[15-02-2023 - 09:16:49]]></Time>
<TimeTick>1676432809</TimeTick>
<Step rID="T6">
<Obj plainTxt="False" ><![CDATA[OrangeHRM]]></Obj>
<Details plainTxt="False" ><![CDATA[Page]]></Details>
<Time><![CDATA[15-02-2023 - 09:16:49]]></Time>
<TimeTick>1676432809</TimeTick>
<Step rID="T7">
<Obj plainTxt="False" ><![CDATA[username.Set]]></Obj>
<Details plainTxt="False" ><![CDATA["Admin"]]></Details>
<Time><![CDATA[15-02-2023 - 09:16:49]]></Time>
<TimeTick>1676432809</TimeTick>
<NodeArgs eType="Replay" icon="7" nRep="12" Source="login" SourceLine="0" >
<Disp><![CDATA[username.Set]]></Disp>
</NodeArgs>
</Step>
<Step rID="T8">
<Obj plainTxt="False" ><![CDATA[password.Set]]></Obj>
<Details plainTxt="False" ><![CDATA["63ec54c0635a892658cbb68743e5d573474b0cb9a352"]]></Details>
<Time><![CDATA[15-02-2023 - 09:16:49]]></Time>
<TimeTick>1676432809</TimeTick>
<NodeArgs eType="Replay" icon="7" nRep="15" Source="login" SourceLine="1" >
<Disp><![CDATA[password.Set]]></Disp>
</NodeArgs>
</Step>
<Step rID="T9">
<Obj plainTxt="False" ><![CDATA[Login.Click]]></Obj>
<Details plainTxt="False" ><![CDATA[]]></Details>
<Time><![CDATA[15-02-2023 - 09:16:50]]></Time>
<TimeTick>1676432810</TimeTick>
<NodeArgs eType="Replay" icon="8" nRep="18" Source="login" SourceLine="2" >
<Disp><![CDATA[Login.Click]]></Disp>
</NodeArgs>
</Step>
<NodeArgs eType="Context" icon="6" nRep="11" Source="login" SourceLine="0" >
<Disp><![CDATA[OrangeHRM]]></Disp>
</NodeArgs>
</Step>
<Step rID="T10">
<Obj plainTxt="False" ><![CDATA[OrangeHRM_2]]></Obj>
<Details plainTxt="False" ><![CDATA[Page]]></Details>
<Time><![CDATA[15-02-2023 - 09:16:51]]></Time>
<TimeTick>1676432811</TimeTick>
<Step rID="T11">
<Obj plainTxt="False" ><![CDATA[PIM.Click]]></Obj>
<Details plainTxt="False" ><![CDATA[]]></Details>
<Time><![CDATA[15-02-2023 - 09:16:51]]></Time>
<TimeTick>1676432811</TimeTick>
<NodeArgs eType="Replay" icon="9" nRep="22" Source="login" SourceLine="3" >
<Disp><![CDATA[PIM.Click]]></Disp>
</NodeArgs>
</Step>
<NodeArgs eType="Context" icon="6" nRep="21" Source="login" SourceLine="3" >
<Disp><![CDATA[OrangeHRM_2]]></Disp>
</NodeArgs>
</Step>
<Step rID="T12">
<Obj plainTxt="False" ><![CDATA[OrangeHRM_3]]></Obj>
<Details plainTxt="False" ><![CDATA[Page]]></Details>
<Time><![CDATA[15-02-2023 - 09:16:53]]></Time>
<TimeTick>1676432813</TimeTick>
<Step rID="T13">
<Obj plainTxt="False" ><![CDATA[WebEdit.Set]]></Obj>
<Details plainTxt="False" ><![CDATA["4567"]]></Details>
<Time><![CDATA[15-02-2023 - 09:16:53]]></Time>
<TimeTick>1676432813</TimeTick>
<NodeArgs eType="Replay" icon="7" nRep="26" Source="login" SourceLine="4" >
<Disp><![CDATA[WebEdit.Set]]></Disp>
</NodeArgs>
</Step>
<Step rID="T14">
<Obj plainTxt="False" ><![CDATA[Add.Click]]></Obj>
<Details plainTxt="False" ><![CDATA[]]></Details>
<Time><![CDATA[15-02-2023 - 09:16:53]]></Time>
<TimeTick>1676432813</TimeTick>
<NodeArgs eType="Replay" icon="10" nRep="29" Source="login" SourceLine="5" >
<Disp><![CDATA[Add.Click]]></Disp>
</NodeArgs>
</Step>
<Step rID="T15">
<Obj plainTxt="False" ><![CDATA[Search.Click]]></Obj>
<Details plainTxt="False" ><![CDATA[]]></Details>
<Time><![CDATA[15-02-2023 - 09:16:53]]></Time>
<TimeTick>1676432813</TimeTick>
<NodeArgs eType="Replay" icon="8" nRep="32" Source="login" SourceLine="6" >
<Disp><![CDATA[Search.Click]]></Disp>
</NodeArgs>
</Step>
<Step rID="T16">
<Obj plainTxt="False" ><![CDATA[PIM.Click]]></Obj>
<Details plainTxt="False" ><![CDATA[]]></Details>
<Time><![CDATA[15-02-2023 - 09:16:53]]></Time>
<TimeTick>1676432813</TimeTick>
<NodeArgs eType="Replay" icon="9" nRep="35" Source="login" SourceLine="7" >
<Disp><![CDATA[PIM.Click]]></Disp>
</NodeArgs>
</Step>
<Step rID="T17">
<Obj plainTxt="False" ><![CDATA[Add.Click]]></Obj>
<Details plainTxt="False" ><![CDATA[]]></Details>
<Time><![CDATA[15-02-2023 - 09:16:55]]></Time>
<TimeTick>1676432815</TimeTick>
<NodeArgs eType="Replay" icon="8" nRep="38" Source="login" SourceLine="8" >
<Disp><![CDATA[Add.Click]]></Disp>
</NodeArgs>
</Step>
<NodeArgs eType="Context" icon="6" nRep="25" Source="login" SourceLine="4" >
<Disp><![CDATA[OrangeHRM_3]]></Disp>
</NodeArgs>
</Step>
<Step rID="T18">
<Obj plainTxt="False" ><![CDATA[OrangeHRM_4]]></Obj>
<Details plainTxt="False" ><![CDATA[Page]]></Details>
<Time><![CDATA[15-02-2023 - 09:16:57]]></Time>
<TimeTick>1676432817</TimeTick>
<Step rID="T19">
<Obj plainTxt="False" ><![CDATA[WebEdit.Set]]></Obj>
<Details plainTxt="False" ><![CDATA["03011"]]></Details>
<Time><![CDATA[15-02-2023 - 09:16:57]]></Time>
<TimeTick>1676432817</TimeTick>
<NodeArgs eType="Replay" icon="7" nRep="43" Source="login" SourceLine="9" >
<Disp><![CDATA[WebEdit.Set]]></Disp>
</NodeArgs>
</Step>
<Step rID="T20">
<Obj plainTxt="False" ><![CDATA[firstName.Set]]></Obj>
<Details plainTxt="False" ><![CDATA["teja"]]></Details>
<Time><![CDATA[15-02-2023 - 09:16:57]]></Time>
<TimeTick>1676432817</TimeTick>
<NodeArgs eType="Replay" icon="7" nRep="46" Source="login" SourceLine="10" >
<Disp><![CDATA[firstName.Set]]></Disp>
</NodeArgs>
</Step>
<Step rID="T21">
<Obj plainTxt="False" ><![CDATA[lastName.Set]]></Obj>
<Details plainTxt="False" ><![CDATA["reddy"]]></Details>
<Time><![CDATA[15-02-2023 - 09:16:57]]></Time>
<TimeTick>1676432817</TimeTick>
<NodeArgs eType="Replay" icon="7" nRep="49" Source="login" SourceLine="11" >
<Disp><![CDATA[lastName.Set]]></Disp>
</NodeArgs>
</Step>
<Step rID="T22">
<Obj plainTxt="False" ><![CDATA[Save.Click]]></Obj>
<Details plainTxt="False" ><![CDATA[]]></Details>
<Time><![CDATA[15-02-2023 - 09:16:57]]></Time>
<TimeTick>1676432817</TimeTick>
<NodeArgs eType="Replay" icon="8" nRep="52" Source="login" SourceLine="12" >
<Disp><![CDATA[Save.Click]]></Disp>
</NodeArgs>
</Step>
<NodeArgs eType="Context" icon="6" nRep="42" Source="login" SourceLine="9" >
<Disp><![CDATA[OrangeHRM_4]]></Disp>
</NodeArgs>
</Step>
<Step rID="T23">
<Obj plainTxt="False" ><![CDATA[OrangeHRM_5]]></Obj>
<Details plainTxt="False" ><![CDATA[Page]]></Details>
<Time><![CDATA[15-02-2023 - 09:16:57]]></Time>
<TimeTick>1676432817</TimeTick>
<Step rID="T24">
<Obj plainTxt="False" ><![CDATA[PIM.Click]]></Obj>
<Details plainTxt="False" ><![CDATA[]]></Details>
<Time><![CDATA[15-02-2023 - 09:16:57]]></Time>
<TimeTick>1676432817</TimeTick>
<NodeArgs eType="Replay" icon="9" nRep="56" Source="login" SourceLine="13" >
<Disp><![CDATA[PIM.Click]]></Disp>
</NodeArgs>
</Step>
<NodeArgs eType="Context" icon="6" nRep="55" Source="login" SourceLine="13" >
<Disp><![CDATA[OrangeHRM_5]]></Disp>
</NodeArgs>
</Step>
<Step rID="T25">
<Obj plainTxt="False" ><![CDATA[OrangeHRM_3]]></Obj>
<Details plainTxt="False" ><![CDATA[Page]]></Details>
<Time><![CDATA[15-02-2023 - 09:16:59]]></Time>
<TimeTick>1676432819</TimeTick>
<Step rID="T26">
<Obj plainTxt="False" ><![CDATA[WebEdit.Set]]></Obj>
<Details plainTxt="False" ><![CDATA["03011"]]></Details>
<Time><![CDATA[15-02-2023 - 09:16:59]]></Time>
<TimeTick>1676432819</TimeTick>
<NodeArgs eType="Replay" icon="7" nRep="61" Source="login" SourceLine="14" >
<Disp><![CDATA[WebEdit.Set]]></Disp>
</NodeArgs>
</Step>
<Step rID="T27">
<Obj plainTxt="False" ><![CDATA[Search.Click]]></Obj>
<Details plainTxt="False" ><![CDATA[]]></Details>
<Time><![CDATA[15-02-2023 - 09:16:59]]></Time>
<TimeTick>1676432819</TimeTick>
<NodeArgs eType="Replay" icon="8" nRep="64" Source="login" SourceLine="15" >
<Disp><![CDATA[Search.Click]]></Disp>
</NodeArgs>
</Step>
<Step rID="T28">
<Obj plainTxt="False" ><![CDATA[WebCheckBox.Set]]></Obj>
<Details plainTxt="False" ><![CDATA["ON"]]></Details>
<Time><![CDATA[15-02-2023 - 09:16:59]]></Time>
<TimeTick>1676432819</TimeTick>
<NodeArgs eType="Replay" icon="11" nRep="68" Source="login" SourceLine="16" >
<Disp><![CDATA[WebCheckBox.Set]]></Disp>
</NodeArgs>
</Step>
<Step rID="T29">
<Obj plainTxt="False" ><![CDATA[Delete Selected]]></Obj>
<Details plainTxt="False" ><![CDATA[Cannot&nbsp;identify&nbsp;the&nbsp;object&nbsp;"Delete&nbsp;Selected"&nbsp;(of&nbsp;class&nbsp;WebButton).<br/>Verify&nbsp;that&nbsp;this&nbsp;object's&nbsp;properties&nbsp;match&nbsp;an&nbsp;object&nbsp;currently&nbsp;displayed&nbsp;in&nbsp;your&nbsp;application.]]></Details>
<Time><![CDATA[15-02-2023 - 09:17:20]]></Time>
<TimeTick>1676432840</TimeTick>
<Step rID="T30">
<Obj plainTxt="False" ><![CDATA[Delete Selected]]></Obj>
<Details plainTxt="False" ><![CDATA[Object's physical description:<br>Mercury Class = WebButton<br>Html Tag = BUTTON<br>_xpath = //DIV/DIV/DIV/BUTTON[normalize-space()="Delete Selected"]<br>|Visible = -1<br>Value = Delete Selected<br>Type = button<br>Name = Delete Selected<br>Html Id = <br>DHTML Class = oxd-button oxd-button--medium oxd-button--label-danger orangehrm-horizontal-margin<br>acc_name = <br>]]></Details>
<Time><![CDATA[15-02-2023 - 09:17:20]]></Time>
<TimeTick>1676432840</TimeTick>
<NodeArgs eType="Replay" icon="12" nRep="112" status="Warning" nType="Description" Source="login" SourceLine="17" >
<Disp><![CDATA[Delete Selected]]></Disp>
</NodeArgs>
</Step>
<NodeArgs eType="Replay" icon="8" nRep="111" status="Failed" nType="Run Error" Source="login" SourceLine="17" >
<Disp><![CDATA[Delete Selected]]></Disp>
</NodeArgs>
</Step>
<NodeArgs eType="Context" icon="6" nRep="60" status="Failed" Source="login" SourceLine="14" >
<Disp><![CDATA[OrangeHRM_3]]></Disp>
</NodeArgs>
</Step>
<NodeArgs eType="Context" icon="5" nRep="10" status="Failed" Source="login" SourceLine="0" >
<Disp><![CDATA[OrangeHRM]]></Disp>
</NodeArgs>
</Step>
<Step rID="T31">
<Obj plainTxt="False" ><![CDATA[OrangeHRM]]></Obj>
<Details plainTxt="False" ><![CDATA[<table><tr><td><span style="text-align : left; font-size : 12px; ">Local Browser</span></td></tr></table>]]></Details>
<Time><![CDATA[15-02-2023 - 09:17:20]]></Time>
<TimeTick>1676432840</TimeTick>
<Step rID="T32">
<Obj plainTxt="False" ><![CDATA[Run Error]]></Obj>
<Details plainTxt="False" ><![CDATA[Cannot identify the object &quot;Delete Selected&quot; (of class WebButton).<BR/>Verify that this object's properties match an object currently displayed in your application.<BR/>Line (18): &quot;Browser(&quot;OrangeHRM&quot;).Page(&quot;OrangeHRM_3&quot;).WebButton(&quot;Delete Selected&quot;).Click&quot;. ]]></Details>
<Time><![CDATA[15-02-2023 - 09:17:20]]></Time>
<TimeTick>1676432840</TimeTick>
<NodeArgs eType="Replay" icon="12" nRep="114" status="Failed" Source="login" SourceLine="17" >
<Disp><![CDATA[Run Error]]></Disp>
</NodeArgs>
</Step>
<Step rID="T33">
<Obj plainTxt="False" ><![CDATA[Stop Run]]></Obj>
<Details plainTxt="False" ><![CDATA[Run stopped by user.]]></Details>
<Time><![CDATA[15-02-2023 - 09:17:23]]></Time>
<TimeTick>1676432843</TimeTick>
<NodeArgs eType="General" icon="13" nRep="115" status="Information" >
<Disp><![CDATA[Stop Run]]></Disp>
</NodeArgs>
</Step>
<NodeArgs eType="Context" icon="5" nRep="113" status="Failed" Source="login" SourceLine="17" >
<Disp><![CDATA[OrangeHRM]]></Disp>
</NodeArgs>
</Step>
<Summary sTime="15-02-2023 - 09:16:49" eTime="15-02-2023 - 09:17:23" passed="0" failed="2" warnings="1" ></Summary>
<NodeArgs eType="StartAction" icon="4" nRep="7" status="Failed" >
<Disp><![CDATA[login Summary]]></Disp>
</NodeArgs>
</Action>
<NodeArgs eType="StartIteration" icon="3" nRep="6" status="Failed" >
<Disp><![CDATA[od Iteration 1 (Row 1)]]></Disp>
</NodeArgs>
</DIter>
<Summary sTime="15-02-2023 - 09:16:41" eTime="15-02-2023 - 09:17:23" passed="0" failed="2" warnings="1" ></Summary>
<NodeArgs eType="StartTest" icon="1" nRep="3" status="Failed" >
<Disp><![CDATA[Test od Summary]]></Disp>
</NodeArgs>
</Doc>
</Report>